{
	"$schema": "https://raw.githubusercontent.com/earendil-works/pi/main/packages/coding-agent/src/modes/interactive/theme/theme-schema.json",
	"name": "porcelain",
	"vars": {
		"ink": "#dcdcdc",
		"bright": "#f2f0eb",
		"ivory": "#e6ddc4",
		"silver": "#b0b0b0",
		"gray": "#8a8a8a",
		"ash": "#5c5c5c",
		"faint": "#383838",
		"sage": "#87a987",
		"rose": "#c98a8a",
		"sand": "#c9b28a",
		"mist": "#9db4c0",
		"bgRaise": "#1c1c1c",
		"bgSelect": "#262626",
		"bgTool": "#161616",
		"bgToolOk": "#151815",
		"bgToolErr": "#1a1414"
	},
	"colors": {
		"accent": "ivory",
		"border": "faint",
		"borderAccent": "ash",
		"borderMuted": "faint",
		"success": "sage",
		"error": "rose",
		"warning": "sand",
		"muted": "gray",
		"dim": "ash",
		"text": "",
		"thinkingText": "ash",

		"selectedBg": "bgSelect",
		"userMessageBg": "bgRaise",
		"userMessageText": "ink",
		"customMessageBg": "bgRaise",
		"customMessageText": "silver",
		"customMessageLabel": "ivory",
		"toolPendingBg": "bgTool",
		"toolSuccessBg": "bgToolOk",
		"toolErrorBg": "bgToolErr",
		"toolTitle": "silver",
		"toolOutput": "gray",

		"mdHeading": "bright",
		"mdLink": "mist",
		"mdLinkUrl": "ash",
		"mdCode": "ivory",
		"mdCodeBlock": "silver",
		"mdCodeBlockBorder": "faint",
		"mdQuote": "gray",
		"mdQuoteBorder": "faint",
		"mdHr": "faint",
		"mdListBullet": "ash",

		"toolDiffAdded": "sage",
		"toolDiffRemoved": "rose",
		"toolDiffContext": "ash",

		"syntaxComment": "ash",
		"syntaxKeyword": "bright",
		"syntaxFunction": "ink",
		"syntaxVariable": "silver",
		"syntaxString": "#a8b8a8",
		"syntaxNumber": "#c4b294",
		"syntaxType": "#c9c9c9",
		"syntaxOperator": "gray",
		"syntaxPunctuation": "#6e6e6e",

		"thinkingOff": "faint",
		"thinkingMinimal": "#4e4e4e",
		"thinkingLow": "#6e6e6e",
		"thinkingMedium": "#949494",
		"thinkingHigh": "#c4c4c4",
		"thinkingXhigh": "bright",

		"bashMode": "sand"
	},
	"export": {
		"pageBg": "#111111",
		"cardBg": "#181818",
		"infoBg": "#26231c"
	}
}
