{
	"$schema": "https://raw.githubusercontent.com/earendil-works/pi/main/packages/coding-agent/src/modes/interactive/theme/theme-schema.json",
	"name": "ember",
	"vars": {
		"ink": "#e8dccb",
		"bright": "#fff4e2",
		"cream": "#e6d5b8",
		"gold": "#e6b566",
		"ember": "#f2a24e",
		"rust": "#c25a3a",
		"warmgray": "#b39a86",
		"ash": "#8a7360",
		"char": "#4a3d33",
		"olive": "#a7ad6f",
		"coral": "#e08363",
		"sand": "#d8b06a",
		"sky": "#8fb0b8",
		"bgRaise": "#241b14",
		"bgUser": "#3a2c20",
		"bgSelect": "#2c211a",
		"bgTool": "#1c1510",
		"bgToolOk": "#1c2214",
		"bgToolErr": "#2a1512"
	},
	"colors": {
		"accent": "ember",
		"border": "char",
		"borderAccent": "ash",
		"borderMuted": "char",
		"success": "olive",
		"error": "coral",
		"warning": "sand",
		"muted": "warmgray",
		"dim": "ash",
		"text": "",
		"thinkingText": "ash",

		"selectedBg": "bgSelect",
		"userMessageBg": "bgUser",
		"userMessageText": "ink",
		"customMessageBg": "bgRaise",
		"customMessageText": "cream",
		"customMessageLabel": "ember",
		"toolPendingBg": "bgTool",
		"toolSuccessBg": "bgToolOk",
		"toolErrorBg": "bgToolErr",
		"toolTitle": "gold",
		"toolOutput": "warmgray",

		"mdHeading": "bright",
		"mdLink": "sky",
		"mdLinkUrl": "ash",
		"mdCode": "ember",
		"mdCodeBlock": "gold",
		"mdCodeBlockBorder": "char",
		"mdQuote": "warmgray",
		"mdQuoteBorder": "char",
		"mdHr": "char",
		"mdListBullet": "rust",

		"toolDiffAdded": "olive",
		"toolDiffRemoved": "coral",
		"toolDiffContext": "ash",

		"syntaxComment": "ash",
		"syntaxKeyword": "ember",
		"syntaxFunction": "gold",
		"syntaxVariable": "cream",
		"syntaxString": "#a7ad6f",
		"syntaxNumber": "#d8b06a",
		"syntaxType": "#e6b566",
		"syntaxOperator": "warmgray",
		"syntaxPunctuation": "#8a7360",

		"thinkingOff": "char",
		"thinkingMinimal": "ash",
		"thinkingLow": "warmgray",
		"thinkingMedium": "sand",
		"thinkingHigh": "gold",
		"thinkingXhigh": "ember",

		"bashMode": "sand"
	},
	"export": {
		"pageBg": "#160f0a",
		"cardBg": "#201811",
		"infoBg": "#2a1f12"
	}
}
