{
	"$schema": "https://raw.githubusercontent.com/earendil-works/pi/main/packages/coding-agent/src/modes/interactive/theme/theme-schema.json",
	"name": "porcelain-light",
	"vars": {
		"ink": "#1a1a1a",
		"charcoal": "#2e2e2e",
		"slate": "#4a4a4a",
		"stone": "#6e6e6e",
		"dimGray": "#767676",
		"faintGray": "#b0b0b0",
		"bronze": "#8a6d3a",
		"sage": "#4f7a4f",
		"rose": "#a1494f",
		"amber": "#9c6b12",
		"mist": "#3f6e73",
		"violet": "#6b4fa0",
		"bgRaise": "#f1f1ef",
		"bgSelect": "#e6e2da",
		"bgTool": "#f4f4f2",
		"bgToolOk": "#eef3ec",
		"bgToolErr": "#f6ecec",
		"bgCustom": "#f0eef5"
	},
	"colors": {
		"accent": "bronze",
		"border": "faintGray",
		"borderAccent": "stone",
		"borderMuted": "faintGray",
		"success": "sage",
		"error": "rose",
		"warning": "amber",
		"muted": "stone",
		"dim": "dimGray",
		"text": "ink",
		"thinkingText": "stone",

		"selectedBg": "bgSelect",
		"userMessageBg": "bgRaise",
		"userMessageText": "ink",
		"customMessageBg": "bgCustom",
		"customMessageText": "ink",
		"customMessageLabel": "violet",
		"toolPendingBg": "bgTool",
		"toolSuccessBg": "bgToolOk",
		"toolErrorBg": "bgToolErr",
		"toolTitle": "slate",
		"toolOutput": "stone",

		"mdHeading": "ink",
		"mdLink": "mist",
		"mdLinkUrl": "stone",
		"mdCode": "bronze",
		"mdCodeBlock": "charcoal",
		"mdCodeBlockBorder": "faintGray",
		"mdQuote": "stone",
		"mdQuoteBorder": "faintGray",
		"mdHr": "faintGray",
		"mdListBullet": "bronze",

		"toolDiffAdded": "sage",
		"toolDiffRemoved": "rose",
		"toolDiffContext": "stone",

		"syntaxComment": "stone",
		"syntaxKeyword": "ink",
		"syntaxFunction": "charcoal",
		"syntaxVariable": "slate",
		"syntaxString": "sage",
		"syntaxNumber": "amber",
		"syntaxType": "mist",
		"syntaxOperator": "stone",
		"syntaxPunctuation": "stone",

		"thinkingOff": "faintGray",
		"thinkingMinimal": "stone",
		"thinkingLow": "slate",
		"thinkingMedium": "bronze",
		"thinkingHigh": "mist",
		"thinkingXhigh": "ink",

		"bashMode": "sage"
	},
	"export": {
		"pageBg": "#fafafa",
		"cardBg": "#ffffff",
		"infoBg": "#f4ecd8"
	}
}
